<?xml version="1.0" encoding="UTF-8"?>
<Devices xsi:noNamespaceSchemaLocation="DeviceConfiguration.xsd" xmlns:xsi="http://www.w3.org/2001/XMLSchema-instance">
  
  <ConfigurationName>Configuration 3</ConfigurationName>
  <Device>
    <StartChannel>1</StartChannel>
    <Channels>8</Channels>
    <Type>9281CA</Type>
    <SerialNumber>591279</SerialNumber>
    <Manufacturer>Kistler</Manufacturer>
    <Name>Plate 1</Name>
    <PlateInternalAmp>
      <Physical>
        <Width_mm>400</Width_mm>
        <Length_mm>600</Length_mm>
        <a_mm>120</a_mm>
        <b_mm>200</b_mm>
        <Azx_mm>-45</Azx_mm>
      </Physical>
      <Sensitivities>
        <Sx12_mVperN>19.989</Sx12_mVperN>
        <Sx34_mVperN>19.711</Sx34_mVperN>
        <Sy14_mVperN>20.119</Sy14_mVperN>
        <Sy23_mVperN>20.161</Sy23_mVperN>
        <Sz1_mVperN>2.916</Sz1_mVperN>
        <Sz2_mVperN>2.903</Sz2_mVperN>
        <Sz3_mVperN>2.971</Sz3_mVperN>
        <Sz4_mVperN>2.944</Sz4_mVperN>
      </Sensitivities>
      <Control>
        <RangeXY>Range2</RangeXY>
        <RangeZ>Range3</RangeZ>
      </Control>
      <Offsets>
        <AutoAdjustOffsets>true</AutoAdjustOffsets>
      </Offsets>
     </PlateInternalAmp>
  </Device>

  <Device>
    <StartChannel>9</StartChannel>
    <Channels>6</Channels>
    <Type>SG1</Type>
    <SerialNumber>12345</SerialNumber>
    <Manufacturer>MFG-A</Manufacturer>
    <Name>Plate 2</Name>
      <PlateStrainGage>
        <Physical>
          <Width_mm>400</Width_mm>
          <Length_mm>600</Length_mm>
          <a_mm>10</a_mm>
          <b_mm>20</b_mm>
          <Azx_mm>30</Azx_mm>
        </Physical>
        <Matrix>
          <R1_S>1000</R1_S>
          <R1_S>0</R1_S>
          <R1_S>0</R1_S>
          <R1_S>0</R1_S>
          <R1_S>0</R1_S>
          <R1_S>0</R1_S>
          <R2_S>0</R2_S>
          <R2_S>1000</R2_S>
          <R2_S>0</R2_S>
          <R2_S>0</R2_S>
          <R2_S>0</R2_S>
          <R2_S>0</R2_S>
          <R3_S>0</R3_S>
          <R3_S>0</R3_S>
          <R3_S>1000</R3_S>
          <R3_S>0</R3_S>
          <R3_S>0</R3_S>
          <R3_S>0</R3_S>
          <R4_S>0</R4_S>
          <R4_S>0</R4_S>
          <R4_S>0</R4_S>
          <R4_S>1000</R4_S>
          <R4_S>0</R4_S>
          <R4_S>0</R4_S>
          <R5_S>0</R5_S>
          <R5_S>0</R5_S>
          <R5_S>0</R5_S>
          <R5_S>0</R5_S>
          <R5_S>1000</R5_S>
          <R5_S>0</R5_S>
          <R6_S>0</R6_S>
          <R6_S>0</R6_S>
          <R6_S>0</R6_S>
          <R6_S>0</R6_S>
          <R6_S>0</R6_S>
          <R6_S>1000</R6_S>
        </Matrix>
        <Offsets>
          <AutoAdjustOffsets>true</AutoAdjustOffsets>
          <Offset_mV>0</Offset_mV>
        </Offsets>
        <AmplifierGain>
          <Gain>10</Gain>
          <Gain>10</Gain>
          <Gain>10</Gain>
          <Gain>5</Gain>
          <Gain>5</Gain>
          <Gain>5</Gain>
        </AmplifierGain>
      </PlateStrainGage>
  </Device>
  
  <Device>
    <StartChannel>15</StartChannel>
    <Channels>1</Channels>
    <Type>Accelerometer</Type>
    <SerialNumber>K12345</SerialNumber>
    <Manufacturer>Kistler</Manufacturer>
    <Name>Accelerometer 1</Name>
    <Units>m/s/s</Units>
    <Auxiliary>
      <Sensitivities>
        <S_mVperMU>1000</S_mVperMU>
      </Sensitivities>
      <Offsets>
        <AutoAdjustOffsets>false</AutoAdjustOffsets>
        <Offset_mV>5000</Offset_mV>
      </Offsets>
    </Auxiliary>
  </Device>
  
  <Device>
    <StartChannel>16</StartChannel>
    <Channels>1</Channels>
    <Type>Accelerometer</Type>
    <SerialNumber>K12346</SerialNumber>
    <Manufacturer>Kistler</Manufacturer>
    <Name>Accelerometer 2</Name>
    <Units>m/s/s</Units>
    <Auxiliary>
      <Sensitivities>
        <S_mVperMU>1002.5</S_mVperMU>
      </Sensitivities>
      <Offsets>
        <AutoAdjustOffsets>false</AutoAdjustOffsets>
        <Offset_mV>5000</Offset_mV>
      </Offsets>
    </Auxiliary>
  </Device>
</Devices>
