<?xml version="1.0" encoding="utf-8" ?>
<Devices xsi:noNamespaceSchemaLocation="C:\Program Files (x86)\Kistler\DataServer\DeviceConfiguration.xsd" xmlns:xsi="http://www.w3.org/2001/XMLSchema-instance">
    <ConfigurationName>Config 1</ConfigurationName>
    <Device>
        <Type>5167A81</Type>
        <SerialNumber>5536327</SerialNumber>
        <Name>LabAmp-5536327</Name>
        <PlateEthernetAmp>
            <Address>192.168.123.217</Address>
            <Physical>
                <Width_mm>900</Width_mm>
                <Length_mm>900</Length_mm>
                <a_mm>350</a_mm>
                <b_mm>350</b_mm>
                <Azx_mm>-70</Azx_mm>
            </Physical>
            <Control>
                <RangeXY>Range3</RangeXY>
                <RangeZ>Range4</RangeZ>
            </Control>
            <Offsets>
                <AutoAdjustOffsets>false</AutoAdjustOffsets>
            </Offsets>
            <COP_polynomial>
                <X>0</X>
                <X>0</X>
                <X>0</X>
                <X>0</X>
                <X>0</X>
                <X>0</X>
                <X>0</X>
                <X>0</X>
                <X>0</X>
                <X>0</X>
                <Y>0</Y>
                <Y>0</Y>
                <Y>0</Y>
                <Y>0</Y>
                <Y>0</Y>
                <Y>0</Y>
                <Y>0</Y>
                <Y>0</Y>
                <Y>0</Y>
                <Y>0</Y>
            </COP_polynomial>
            <Orientation>
                <dx_mm>0</dx_mm>
                <dy_mm>0</dy_mm>
                <alpha_deg>0</alpha_deg>
            </Orientation>
           <MoCapData>
              <Location>
                 <dx_mm>200</dx_mm>
                 <dy_mm>300</dy_mm>
                 <dz_mm>0</dz_mm>
              </Location>
              <Orientation>
                 <rx_deg>0</rx_deg>
                 <ry_deg>0</ry_deg>
                 <rz_deg>0</rz_deg>
             </Orientation>
	       </MoCapData>
           <Custom>
              <Message></Message>
           </Custom>            
        </PlateEthernetAmp>
    </Device>
</Devices>