<?xml version="1.0" encoding="UTF-8"?>
<Devices xsi:noNamespaceSchemaLocation="DeviceConfiguration.xsd" xmlns:xsi="http://www.w3.org/2001/XMLSchema-instance">
  
  <ConfigurationName>Configuration 1</ConfigurationName>
  <Device>
    <StartChannel>1</StartChannel>
    <Channels>8</Channels>
    <Type>9281CA</Type>
    <SerialNumber>591279</SerialNumber>
    <Manufacturer>Kistler</Manufacturer>
    <Name>Plate 1</Name>
    <PlateInternalAmp>
      <Physical>
        <Width_mm>400</Width_mm>
        <Length_mm>600</Length_mm>
        <a_mm>120</a_mm>
        <b_mm>200</b_mm>
        <Azx_mm>-45</Azx_mm>
      </Physical>
      <Sensitivities>
        <Sx12_mVperN>19.989</Sx12_mVperN>
        <Sx34_mVperN>19.711</Sx34_mVperN>
        <Sy14_mVperN>20.119</Sy14_mVperN>
        <Sy23_mVperN>20.161</Sy23_mVperN>
        <Sz1_mVperN>2.916</Sz1_mVperN>
        <Sz2_mVperN>2.903</Sz2_mVperN>
        <Sz3_mVperN>2.971</Sz3_mVperN>
        <Sz4_mVperN>2.944</Sz4_mVperN>
      </Sensitivities>
      <Control>
        <RangeXY>Range2</RangeXY>
        <RangeZ>Range3</RangeZ>
      </Control>
      <Offsets>
        <AutoAdjustOffsets>true</AutoAdjustOffsets>
      </Offsets>
     </PlateInternalAmp>
  </Device>
  
</Devices>
